<?xml version="1.0" encoding="UTF-8"?>
<portfolio modified="2006-08-24" xmlns="http://3amproductions.net/xml/ns/twix/" xmlns:xhtml="http://www.w3.org/1999/xhtml" xmlns:xsi="http://www.w3.org/2001/XMLSchema-instance" xsi:schemaLocation="http://3amproductions.net/xml/ns/twix/ http://3amproductions.net/xml/ns/twix/twix.xsd">
	<project id="threeamv1" class="3am" status="completed">
		<started>2005-05-01</started>
		<modified>2005-05-07</modified>
		<launched>2005-05-07</launched>
		<organization abbr="3am">3AM Productions</organization>
		<contacts>
			<contact>
				<name>Jason Karns</name>
				<email type="business">jason@3amproductions.net</email>
			</contact>
			<contact>
				<name>Gilbert Velasquez</name>
				<email type="business">gilbert@3amproductions.net</email>
			</contact>
		</contacts>
		<directory>threeam</directory>
		<subdomain>threeam</subdomain>
		<livesite>http://threeam.3amproductions.net</livesite>
		<showcase>
			<title>3AM Productions v1.0</title>
			<description>This is the original site that 3AM Productions began with. We choose a color scheme that we liked to reflect our personality and the name of our company. In one week we went from having nothing to what you see here. We used this as an opportunity to create a site under pressure.</description>
			<images>
				<feature>
					<thumbnail>http://3amproductions.net/images/3AMv1.gif</thumbnail>
				</feature>
				<screenshot>
					<src>http://3amproductions.net/images/3big01.gif</src>
					<thumbnail>http://3amproductions.net/images/3alt01.gif</thumbnail>
				</screenshot>
				<screenshot>
					<src>http://3amproductions.net/images/3big02.gif</src>
					<thumbnail>http://3amproductions.net/images/3alt02.gif</thumbnail>
				</screenshot>
				<screenshot>
					<src>http://3amproductions.net/images/3big03.gif</src>
					<thumbnail>http://3amproductions.net/images/3alt03.gif</thumbnail>
				</screenshot>
			</images>
		</showcase>
	</project>
	<project id="threeamv2" class="3am" status="managed">
		<started>2006-04-01</started>
		<modified>2006-05-01</modified>
		<launched>2006-05-01</launched>
		<organization abbr="3am">3AM Productions</organization>
		<contacts>
			<contact>
				<name>Jason Karns</name>
				<email type="business">jason@3amproductions.net</email>
			</contact>
			<contact>
				<name>Gilbert Velasquez</name>
				<email type="business">gilbert@3amproductions.net</email>
			</contact>
		</contacts>
		<directory>3am</directory>
		<livesite>http://3amproductions.net</livesite>
		<showcase>
			<title>3AM Productions v2.0</title>
			<description>This is our current site which we made as an update and also to be a part of the <xhtml:a href="http://www.cssreboot.com" title="see the reboots" rel="external">May 2006 CSS Reboot</xhtml:a>. We have gone with a minimalistic approach giving the user a bold visual experience while separating the content without the use of heavy images.</description>
			<images>
				<feature>
					<thumbnail>http://3amproductions.net/images/3AMv2.gif</thumbnail>
				</feature>
				<screenshot>
					<src>http://3amproductions.net/images/3v2big01.gif</src>
					<thumbnail>http://3amproductions.net/images/3v2alt01.gif</thumbnail>
				</screenshot>
				<screenshot>
					<src>http://3amproductions.net/images/3v2big02.gif</src>
					<thumbnail>http://3amproductions.net/images/3v2alt02.gif</thumbnail>
				</screenshot>
				<screenshot>
					<src>http://3amproductions.net/images/3v2big03.gif</src>
					<thumbnail>http://3amproductions.net/images/3v2alt03.gif</thumbnail>
				</screenshot>
			</images>
		</showcase>
	</project>
	<project id="argentum" class="business" status="terminated" manager="jason">
		<started>2004-03-01</started>
		<modified>2004-03-01</modified>
		<organization>Argentum</organization>
		<directory>argentum</directory>
	</project>
	<project id="ghsnhs" class="business" status="terminated" manager="jason">
		<started>2001-11-01</started>
		<modified>2001-11-01</modified>
		<organization abbr="GNHS">Graham HS National Honor Society</organization>
		<directory>nhs</directory>
	</project>
	<project id="caduceus" class="business" status="terminated" manager="jason">
		<started>2004-09-01</started>
		<modified>2004-09-01</modified>
		<organization abbr="CadCorp">The Caduceus Corporation</organization>
		<contacts>
			<contact>
				<name>Kenneth Ryan</name>
				<email type="personal">tcckcr@yahoo.com</email>
			</contact>
		</contacts>
		<directory>caduceus</directory>
		<subdomain>caduceus</subdomain>
		<livesite>http://www.needle-zapper.com</livesite>
	</project>
	<project id="arts" class="business" status="terminated" manager="jason">
		<started>2005-06-25</started>
		<modified>2005-06-25</modified>
		<organization>Gibson Crafts</organization>
		<contacts>
			<contact>
				<name>Tammy Gibson</name>
				<email type="personal">megib@netzero.com</email>
			</contact>
		</contacts>
	</project>
	<project id="perceptionist" class="business" status="terminated" manager="gil">
		<started>2005-01-01</started>
		<modified>2005-01-01</modified>
		<organization>Perceptionist Inc.</organization>
		<contacts>
			<contact>
				<name>Tiger Downey</name>
				<email type="business">tigerd@perceptionistinc.com</email>
			</contact>
		</contacts>
		<directory>perceptionist</directory>
		<subdomain>perceptionist</subdomain>
		<livesite>http://www.myperceptionist.com</livesite>
	</project>
	<project id="ghsband" class="probono" status="managed" manager="jason">
		<started>2000-08-01</started>
		<modified>2005-11-21</modified>
		<launched>2000-08-01</launched>
		<organization>Graham Band</organization>
		<contacts>
			<contact>
				<name>Jason Karns</name>
				<email type="business">ghsband@ctcn.net</email>
			</contact>
		</contacts>
		<directory>band</directory>
		<livesite>http://www.grahamband.com/</livesite>
	</project>
	<project id="ghsaa" class="probono" status="draft" manager="jason">
		<started>2002-06-09</started>
		<modified>2002-06-09</modified>
		<organization abbr="GHSAA">Graham HS Alumni Association</organization>
		<contacts>
			<contact>
				<name>Roberta Vetters</name>
				<email type="personal">birtiev@hotmail.com</email>
			</contact>
		</contacts>
		<directory>ghsaa</directory>
		<subdomain>ghsaa</subdomain>
	</project>
	<project id="lso" class="probono" status="draft" manager="gil">
		<started>2005-10-01</started>
		<modified>2006-10-05</modified>
		<organization abbr="LSO">The Libertarian Studies Organization</organization>
		<contacts>
			<contact>
				<name>Brandon Dobyns</name>
				<email type="personal">dobyns.5@osu.edu</email>
			</contact>
		</contacts>
		<directory>lso</directory>
		<livesite>http://lso.org.ohio-state.edu/</livesite>
	</project>
	<project id="legs" class="private" status="managed" manager="jason">
		<started>2002-01-17</started>
		<modified>2004-09-17</modified>
		<launched>2002-01-17</launched>
		<organization abbr="Legs">The Legs and the Woman</organization>
		<contacts>
			<contact>
				<name>Brandon Dobyns</name>
				<email type="personal">dobyns.5@osu.edu</email>
			</contact>
		</contacts>
		<directory>legs</directory>
		<livesite>http://thesanctuary.bravepages.com/legs</livesite>
	</project>
	<project id="sanctuary" class="private" status="managed" manager="jason">
		<started>2001-03-30</started>
		<modified>2002-08-01</modified>
		<launched>2001-03-30</launched>
		<organization>The Sanctuary</organization>
		<contacts>
			<contact>
				<name>Jason Karns</name>
				<email type="personal">karnsj@cse.ohio-state.edu</email>
			</contact>
		</contacts>
		<directory>sanctuary</directory>
		<livesite>http://thesanctuary.bravepages.com</livesite>
	</project>
	<project id="jelloshot" class="private" status="draft" manager="gil">
		<started>2006-01-01</started>
		<modified>2006-01-01</modified>
		<organization>JelloShot.com</organization>
		<contacts>
			<contact>
				<name>Gilbert Velasquez</name>
				<email type="business">gilbert@3amproductions.net</email>
			</contact>
		</contacts>
		<subdomain>jelloshot</subdomain>
		<showcase>
			<title>JelloShot.com</title>
			<description>This site was a mockup created as part of a project for an information systems class. This is the first iteration of a new compnay idea being proposed by that group. It was targeted to the college age group and so the colors are very strong and bold with catchy images the market can relate to.</description>
			<images>
				<feature>
					<thumbnail>http://3amproductions.net/images/JelloShotv1.gif</thumbnail>
				</feature>
				<screenshot>
					<src>http://3amproductions.net/images/Jbig01.gif</src>
					<thumbnail>http://3amproductions.net/images/Jalt01.gif</thumbnail>
				</screenshot>
				<screenshot>
					<src>http://3amproductions.net/images/Jbig02.gif</src>
					<thumbnail>http://3amproductions.net/images/Jalt02.gif</thumbnail>
				</screenshot>
				<screenshot>
					<src>http://3amproductions.net/images/Jbig03.gif</src>
					<thumbnail>http://3amproductions.net/images/Jalt03.gif</thumbnail>
				</screenshot>
			</images>
		</showcase>
	</project>
	<project id="ipokr" class="personal" status="hold" manager="gil">
		<started>2006-04-01</started>
		<modified>2006-07-12</modified>
		<organization abbr="iPokr">iPokr International</organization>
		<contacts>
			<contact>
				<name>Jason Karns</name>
				<email type="personal">karnsj@cse.ohio-state.edu</email>
			</contact>
			<contact>
				<name>Mike Busch</name>
				<email type="personal">busch@cse.ohio-state.edu</email>
			</contact>
			<contact>
				<name>Scott Bickel</name>
				<email type="personal">bickels@cse.ohio-state.edu</email>
			</contact>
		</contacts>
		<directory>ipokr</directory>
		<subdomain>ipokr</subdomain>
	</project>
	<project id="latinostudies" class="personal" status="completed" manager="gil">
		<started>2006-01-01</started>
		<modified>2006-04-01</modified>
		<launched>2006-04-01</launched>
		<organization abbr="LatinoStudies">Latino Studies</organization>
		<contacts>
			<contact>
				<name>Gilbert Velasquez</name>